{
  "$schema": "https://raw.githubusercontent.com/dkharlanau/agent-ready-web-profile/main/schema/portfolio-growth-run.schema.json",
  "version": "0.1",
  "runId": "20261025T175623Z",
  "observedAt": "2026-10-25T17:56:23.000Z",
  "evidenceClass": "owner-controlled-public-observation",
  "portfolioUpdatedAt": "2026-10-25",
  "summary": {
    "enabledSites": 9,
    "captured": 9,
    "unavailable": 0,
    "awaitingOwnerMeasurement": 9
  },
  "sites": [
    {
      "siteId": "bonihua-chinese-learning",
      "name": "Bonihua",
      "canonicalUrl": "https://www.bonihua.com/",
      "repository": "metalhatscats/bonihua",
      "vertical": "editorial",
      "rolloutMode": "observe-only",
      "measurementState": "awaiting-owner-measurement",
      "status": "captured",
      "snapshot": {
        "snapshotVersion": "0.1",
        "growthProfile": "2026-09-06",
        "canonicalUrl": "https://www.bonihua.com/",
        "observedAt": "2026-10-25T17:56:23.000Z",
        "toolVersion": "0.2.0",
        "actions": [
          {
            "id": "audit:google-read-more-deep-links",
            "priority": "P2",
            "lane": "citation",
            "status": "warn",
            "title": "Keep important sections deep-linkable",
            "source": "https://developers.google.com/search/docs/appearance/snippet",
            "reasonDigest": "sha256:b15484eb96ccf8f8ad4b759a89381ab133e4c7c6f69bbf1ec602f98a0713cd97"
          },
          {
            "id": "audit:google-sitemap-lastmod",
            "priority": "P2",
            "lane": "freshness",
            "status": "warn",
            "title": "Publish accurate sitemap freshness metadata",
            "source": "https://developers.google.com/search/docs/crawling-indexing/sitemaps/build-sitemap",
            "reasonDigest": "sha256:27c1c56e1d6803d229a02225e7b530557a321421ad466ffd1e4cc80c05ba826b"
          },
          {
            "id": "growth:bing-ai-citation-measurement",
            "priority": "P1",
            "lane": "measurement",
            "status": "external-owner-data",
            "title": "Track citations and grounding queries in Bing AI Performance",
            "source": "https://www.bing.com/webmasters/help/ai-performance-9f8e7d6c",
            "reasonDigest": "sha256:be6488edc0b81d85b91f130c67e19c4554586789ee4c97b47fff963215b55807"
          },
          {
            "id": "growth:google-generative-ai-measurement-global",
            "priority": "P1",
            "lane": "measurement",
            "status": "external-owner-data",
            "title": "Track generative Search visibility as a first-class KPI",
            "source": "https://developers.google.com/search/blog/2026/06/gen-ai-performance-reports",
            "reasonDigest": "sha256:be6488edc0b81d85b91f130c67e19c4554586789ee4c97b47fff963215b55807"
          },
          {
            "id": "growth:non-commodity-review",
            "priority": "P1",
            "lane": "content-quality",
            "status": "manual",
            "title": "Run the non-commodity content review on priority landing/article pages",
            "source": "https://developers.google.com/search/docs/fundamentals/ai-optimization-guide",
            "reasonDigest": "sha256:a0ca4d7f699217bbdde3c53da8d32062f7e73370ceb5b65f3dad7ff8b1d90f69"
          },
          {
            "id": "growth:site-reputation-policy",
            "priority": "P1",
            "lane": "governance",
            "status": "manual",
            "title": "Keep third-party content within the site’s real editorial purpose",
            "source": "https://developers.google.com/search/blog/2026/08/update-site-reputation-policy",
            "reasonDigest": "sha256:3c8a062b5ec3a028fff3b2b1ab3f3fbfab89caab72a0d93c9473cc8f3b80bb2a"
          },
          {
            "id": "trend-owner:google-generative-ai-control-global",
            "priority": "P1",
            "lane": "ai-access",
            "status": "external-owner-data",
            "title": "Verify the site's Search generative AI inclusion setting",
            "source": "https://support.google.com/webmasters/answer/16908024?hl=en",
            "reasonDigest": "sha256:8898fee59066be43dffb3b20218e9a7044a7ff6a71b7ad493f3ec5b6e0cba81a"
          }
        ],
        "debt": {
          "p0": 0,
          "p1": 5,
          "highPriority": 5,
          "byPriority": {
            "P2": 2,
            "P1": 5
          },
          "highPriorityByLane": {
            "measurement": 2,
            "content-quality": 1,
            "governance": 1,
            "ai-access": 1
          }
        },
        "observations": {
          "entity": {
            "present": true,
            "sameAs": 3,
            "types": [
              "organization"
            ]
          },
          "localSitemap": {
            "ok": false,
            "validLastmodCount": 0
          },
          "contentSignal": {
            "observed": true,
            "values": {
              "ai-train": "no",
              "search": "yes",
              "ai-input": "yes"
            }
          },
          "article": {
            "count": 0,
            "missingAuthor": 0,
            "missingDateModified": 0
          },
          "media": {
            "images": 2,
            "videos": 0,
            "openGraphImage": true
          }
        },
        "guardrails": {
          "snapshotTracksImplementationStateNotRanking": true,
          "resolvedActionDoesNotProveOutcome": true,
          "ownerMetricsAreSeparateEvidence": true
        },
        "snapshotId": "urn:sha256:6c1b791f38fd52ce3e80ad3a5290e6bd9e9e6c5e8bee7342bc936355cb21c069",
        "digest": "sha256:6c1b791f38fd52ce3e80ad3a5290e6bd9e9e6c5e8bee7342bc936355cb21c069"
      },
      "verticalEvidence": {
        "coverage": "bounded-relevant-surface-public-evidence",
        "pagesObserved": 3,
        "summary": {
          "manual": 3
        }
      },
      "ownerDataState": {
        "observed": false,
        "valid": false,
        "recordCount": 0
      },
      "error": null
    },
    {
      "siteId": "brali-practical-knowledge",
      "name": "Brali Practical Knowledge Library",
      "canonicalUrl": "https://brali-lifeos.github.io/",
      "repository": "Brali-LifeOS/brali-lifeos.github.io",
      "vertical": "editorial",
      "rolloutMode": "proposal-only",
      "measurementState": "awaiting-owner-measurement",
      "status": "captured",
      "snapshot": {
        "snapshotVersion": "0.1",
        "growthProfile": "2026-09-06",
        "canonicalUrl": "https://brali-lifeos.github.io/",
        "observedAt": "2026-10-25T17:56:23.000Z",
        "toolVersion": "0.2.0",
        "actions": [
          {
            "id": "audit:google-sitemap-lastmod",
            "priority": "P2",
            "lane": "freshness",
            "status": "warn",
            "title": "Publish accurate sitemap freshness metadata",
            "source": "https://developers.google.com/search/docs/crawling-indexing/sitemaps/build-sitemap",
            "reasonDigest": "sha256:27c1c56e1d6803d229a02225e7b530557a321421ad466ffd1e4cc80c05ba826b"
          },
          {
            "id": "growth:bing-ai-citation-measurement",
            "priority": "P1",
            "lane": "measurement",
            "status": "external-owner-data",
            "title": "Track citations and grounding queries in Bing AI Performance",
            "source": "https://www.bing.com/webmasters/help/ai-performance-9f8e7d6c",
            "reasonDigest": "sha256:be6488edc0b81d85b91f130c67e19c4554586789ee4c97b47fff963215b55807"
          },
          {
            "id": "growth:entity-sameas",
            "priority": "P2",
            "lane": "entity-identity",
            "status": "recommended",
            "title": "Connect the site entity to authoritative external profiles",
            "source": "https://developers.google.com/search/docs/appearance/structured-data/organization",
            "reasonDigest": "sha256:288b4c853e3f2d0abf8f15bc43409f577ed98021bd5cd3aeb5bcc868cd17192d"
          },
          {
            "id": "growth:google-generative-ai-measurement-global",
            "priority": "P1",
            "lane": "measurement",
            "status": "external-owner-data",
            "title": "Track generative Search visibility as a first-class KPI",
            "source": "https://developers.google.com/search/blog/2026/06/gen-ai-performance-reports",
            "reasonDigest": "sha256:be6488edc0b81d85b91f130c67e19c4554586789ee4c97b47fff963215b55807"
          },
          {
            "id": "growth:non-commodity-review",
            "priority": "P1",
            "lane": "content-quality",
            "status": "manual",
            "title": "Run the non-commodity content review on priority landing/article pages",
            "source": "https://developers.google.com/search/docs/fundamentals/ai-optimization-guide",
            "reasonDigest": "sha256:a0ca4d7f699217bbdde3c53da8d32062f7e73370ceb5b65f3dad7ff8b1d90f69"
          },
          {
            "id": "growth:site-reputation-policy",
            "priority": "P1",
            "lane": "governance",
            "status": "manual",
            "title": "Keep third-party content within the site’s real editorial purpose",
            "source": "https://developers.google.com/search/blog/2026/08/update-site-reputation-policy",
            "reasonDigest": "sha256:3c8a062b5ec3a028fff3b2b1ab3f3fbfab89caab72a0d93c9473cc8f3b80bb2a"
          },
          {
            "id": "trend-owner:google-generative-ai-control-global",
            "priority": "P1",
            "lane": "ai-access",
            "status": "external-owner-data",
            "title": "Verify the site's Search generative AI inclusion setting",
            "source": "https://support.google.com/webmasters/answer/16908024?hl=en",
            "reasonDigest": "sha256:8898fee59066be43dffb3b20218e9a7044a7ff6a71b7ad493f3ec5b6e0cba81a"
          }
        ],